{"contract_version":2,"status":"planned","originating_issue":18,"proposed_change_name":"add-collin-cad-access-decoder-foundation","issue_classification":"source_onboarding","problem_statement":"The Collin source contract lacks an implementation-ready, adapter-local foundation for exact decoding of the measured 17-byte NUMERIC wrapper, validation of the privacy-minimized AD_Public projection, and deterministic separation of current and certified observations. The work must not approve account identity, acquire county data, introduce an Access runtime, or create production ingestion or publication behavior.","desired_outcome":"Define a synthetic-only Collin adapter contract that decodes supported NUMERIC values without floating-point conversion, fails closed on malformed values and incompatible schemas, creates typed adapter-local records with separate current and certified observations, preserves physical rows and source identifiers without account-key claims, and keeps provenance and diagnostics within the approved privacy boundary.","assumptions":[],"unresolved_decisions":[],"planning_decisions":[{"decision_id":"D1","status":"resolved_for_draft","source_ids":["3321aaed641cd22210fac979"],"decision_text":"Treat the physical numeric representation as the reader-specific 17-byte wrapper: byte 0 is the canonical sign, followed by four most-significant-word-first 32-bit magnitude words whose bytes are little-endian. Require external precision from 1 through 28 and scale from 0 through precision; decode with exact Decimal arithmetic and reject negative zero, unsupported signs, invalid metadata, wrong widths, non-bytes values, and precision overflow. This is not a universal Access, Jet, Automation DECIMAL, or OLE DB DB_NUMERIC layout.","requires_human_merge":true},{"decision_id":"D2","status":"resolved_for_draft","source_ids":["be2861af666dfc3b02456915"],"decision_text":"Support exactly the AD_Public table and the privacy-minimized projection comprising prop_id, geo_id, property_status, curr_val_yr, cert_val_yr, the eleven curr_* value fields, and the eleven cert_* value fields. Bind exact case-sensitive names, validate physical type, width, precision, scale, and nullability, fail closed on missing, duplicate, colliding, aliased, positional, or incompatible required structure, and calculate a canonical SHA-256 fingerprint over every observed descriptor. Additional columns remain metadata-only and produce a bounded warning.","requires_human_merge":true},{"decision_id":"D3","status":"resolved_for_draft","source_ids":["c3dd5eb82533bab379d6af62"],"decision_text":"Emit current fields and consistently populated certified fields as separate immutable adapter-local observations. Each observation retains its source family, source year, status, exact source-column lineage, caller-supplied release identifier and source member, table, one-based physical row number, parser contract version, and schema fingerprint. Matching years or values do not permit merging, overwriting, suppression, relabeling, or family-to-family filling.","requires_human_merge":true},{"decision_id":"D4","status":"resolved_for_draft","source_ids":["8230e8434d4ed3576ea75416"],"decision_text":"Accept prop_id only as a non-bool integer from 1 through 2147483647 without approving it as an account key. Trim geo_id using the approved ASCII-whitespace rules, preserve its remaining case, punctuation, and leading zeroes, and reject empty, overlong, NUL, or C0-control values. Enforce approved status, year, monetary, null-family, exact Decimal, diagnostic, privacy, implementation-scope, and Issue 43 boundaries. Keep all implementation adapter-local, synthetic, and non-production.","requires_human_merge":true}],"affected_capabilities":[{"name":"collin-cad-source-contract","change_type":"ADDED"}],"cross_issue_dependencies":[{"issue_number":43,"relationship":"related_to","boundary":["production release-processing API","vendor-neutral source-record abstraction","shared provenance abstraction","shared native-value abstraction","bounded streaming boundary","Collin DAG integration"]}],"declared_write_scope":["libs/property-tax-adapters/src/property_tax_adapters/sources/texas/collin/","libs/property-tax-adapters/tests/sources/texas/collin/","libs/property-tax-adapters/tests/fixtures/collin-access/","docs/sources/"],"files_to_create":["openspec/changes/add-collin-cad-access-decoder-foundation/.openspec.yaml","openspec/changes/add-collin-cad-access-decoder-foundation/proposal.md","openspec/changes/add-collin-cad-access-decoder-foundation/design.md","openspec/changes/add-collin-cad-access-decoder-foundation/tasks.md","openspec/changes/add-collin-cad-access-decoder-foundation/specs/collin-cad-source-contract/spec.md"],"files_to_modify":[],"proposed_files":["openspec/changes/add-collin-cad-access-decoder-foundation/.openspec.yaml","openspec/changes/add-collin-cad-access-decoder-foundation/proposal.md","openspec/changes/add-collin-cad-access-decoder-foundation/design.md","openspec/changes/add-collin-cad-access-decoder-foundation/tasks.md","openspec/changes/add-collin-cad-access-decoder-foundation/specs/collin-cad-source-contract/spec.md"],"task_slices":[{"task_id":"1.1","title":"Add independent Collin NUMERIC and row fixtures","description":"Apply D1 through D4 by adding independently authored literal byte vectors and synthetic schema and row fixtures for zero, signed, scaled, multiword, precision-boundary, year, monetary, dual-family, malformed, repeated-row, and privacy cases. Expected values must be reviewed independently of the decoder, and fixtures must contain no county, owner, mailing, address, or production data.","write_paths":["libs/property-tax-adapters/tests/fixtures/collin-access/"],"validation_checks":["make test"],"prerequisites":["D1","D2","D3","D4"],"risk":"normal","source_ids":["3321aaed641cd22210fac979","be2861af666dfc3b02456915","c3dd5eb82533bab379d6af62","8230e8434d4ed3576ea75416","7676ed46a8bb877ba7fdaac0"]},{"task_id":"2.1","title":"Implement Collin numeric and structural contracts","description":"After task 1.1, implement the adapter-local exact NUMERIC decoder, descriptor types, canonical schema fingerprint, required AD_Public projection, stable structural diagnostics, and fail-closed compatibility validation. Do not add a runtime reader, network access, county artifact, or dependency.","write_paths":["libs/property-tax-adapters/src/property_tax_adapters/sources/texas/collin/","libs/property-tax-adapters/tests/sources/texas/collin/"],"validation_checks":["make lint","make typecheck","make test"],"prerequisites":["D1","D2","D4","1.1"],"risk":"high","source_ids":["3321aaed641cd22210fac979","be2861af666dfc3b02456915","8230e8434d4ed3576ea75416","76e21fb4c68b6f87724edaac"]},{"task_id":"3.1","title":"Implement typed Collin records and dual observations","description":"After task 2.1, add adapter-local typed source records, exact source-native values, identifier and status validation, current and certified observation conversion, mandatory provenance, and physical-row preservation. Do not introduce the shared abstractions or production release-processing boundary owned by Issue 43.","write_paths":["libs/property-tax-adapters/src/property_tax_adapters/sources/texas/collin/","libs/property-tax-adapters/tests/sources/texas/collin/"],"validation_checks":["make lint","make typecheck","make test"],"prerequisites":["D2","D3","D4","2.1"],"risk":"normal","source_ids":["be2861af666dfc3b02456915","c3dd5eb82533bab379d6af62","8230e8434d4ed3576ea75416"]},{"task_id":"4.1","title":"Complete Collin failure, privacy, and boundary tests","description":"After tasks 1.1, 2.1, and 3.1, extend the adapter tests and synthetic fixtures to cover malformed numeric representations, incompatible schemas, invalid identifiers and years, monetary limits, certified-family consistency, repeated-row preservation, bounded diagnostics, excluded owner and address fields, architecture boundaries, and the non-production runtime posture.","write_paths":["libs/property-tax-adapters/tests/sources/texas/collin/","libs/property-tax-adapters/tests/fixtures/collin-access/"],"validation_checks":["make test","make check"],"prerequisites":["D1","D2","D3","D4","1.1","2.1","3.1"],"risk":"normal","source_ids":["515a41057d446a949cae5adc","8230e8434d4ed3576ea75416","7676ed46a8bb877ba7fdaac0","c83b55e968e3981f0030935d"]},{"task_id":"5.1","title":"Document the Collin decoder foundation","description":"After task 4.1, add bounded source documentation describing the reader-specific 17-byte wrapper, independent fixtures, schema and dual-roll semantics, unresolved account identity, physical-row preservation, provenance and diagnostics, privacy restrictions, source-license boundary, Issue 43 dependency, resource limitations, and non-production status. Link to the OpenSpec change rather than duplicating its normative requirements.","write_paths":["docs/sources/"],"validation_checks":["make docs"],"prerequisites":["D1","D2","D3","D4","4.1"],"risk":"low","source_ids":["3321aaed641cd22210fac979","c3dd5eb82533bab379d6af62","8230e8434d4ed3576ea75416","3ff4dd1258ffbf8403ca8eec","37b0be1db5c2ff2ef21f3eae"]}],"requirements":[{"id":"decode-numeric-wrapper-exactly","title":"Decode the bounded NUMERIC wrapper exactly","normative_rule":"The Collin adapter SHALL decode only the approved 17-byte NUMERIC wrapper by interpreting its canonical sign byte and four most-significant-word-first little-endian magnitude words, applying external precision and scale metadata with Decimal arithmetic, and SHALL NOT convert through binary floating point, silently round, or coerce the exponent.","scenarios":[{"name":"Decode independent signed and multiword vectors","given":["independently authored 17-byte positive, negative, scaled, multiword, boundary, 2025, 2026, and monetary byte literals","reviewed expected Decimal values and approved precision and scale metadata"],"when":"the adapter decodes each literal","then":["the exact reviewed Decimal value is